{
  "name": "passport-photo-specs",
  "version": "1.0.0",
  "source_checked": "2026-10-12",
  "license": "CC-BY-4.0",
  "entries": [
    {
      "id": "us-passport",
      "country": "United States",
      "iso2": "US",
      "document": "Passport",
      "width_mm": 51,
      "height_mm": 51,
      "width_px": null,
      "height_px": null,
      "min_px": null,
      "max_px": null,
      "dpi": null,
      "head_height_mm": "25-35",
      "head_height_pct": null,
      "eye_line": null,
      "background": "plain white or off-white",
      "glasses": "not allowed (signed doctor's note if medically required)",
      "expression": "neutral, both eyes open, mouth closed (smile allowed if mouth closed)",
      "digital_format": null,
      "file_size": null,
      "source_url": "https://travel.state.gov/content/travel/en/passports/how-apply/photos.html",
      "source_checked": "2026-10-12",
      "pixid_guide_url": "https://www.pixid.studio/guide/usa",
      "verification": "official_text_read",
      "notes": "2x2 in print. Photo taken within last 6 months; no digital alteration/filters."
    },
    {
      "id": "us-visa-ds-160-nonimmigrant",
      "country": "United States",
      "iso2": "US",
      "document": "Visa (DS-160 nonimmigrant)",
      "width_mm": 51,
      "height_mm": 51,
      "width_px": null,
      "height_px": null,
      "min_px": "600x600",
      "max_px": "1200x1200",
      "dpi": 300,
      "head_height_mm": "22-35",
      "head_height_pct": "50-69",
      "eye_line": null,
      "background": "plain white or off-white",
      "glasses": "not allowed (rare medical exceptions with signed statement)",
      "expression": "neutral, both eyes open",
      "digital_format": "JPEG, sRGB 24-bit, square, compression <=20:1",
      "file_size": "<=240 kB",
      "source_url": "https://travel.state.gov/content/travel/en/us-visas/visa-information-resources/photos/digital-image-requirements.html",
      "source_checked": "2026-10-12",
      "pixid_guide_url": "https://www.pixid.studio/guide/ds-160-photo",
      "verification": "official_text_read",
      "notes": "Head size per general visa photo page; 300 ppi applies when scanning a 2x2 in print. DS-260 immigrant visa: two 2x2 in prints."
    },
    {
      "id": "us-diversity-visa-dv-lottery",
      "country": "United States",
      "iso2": "US",
      "document": "Diversity Visa (DV Lottery)",
      "width_mm": null,
      "height_mm": null,
      "width_px": 600,
      "height_px": 600,
      "min_px": null,
      "max_px": null,
      "dpi": 300,
      "head_height_mm": "22-35",
      "head_height_pct": "50-69",
      "eye_line": null,
      "background": "plain white or off-white",
      "glasses": "not allowed (rare medical exceptions)",
      "expression": "neutral, both eyes open",
      "digital_format": "JPEG, square",
      "file_size": "<=240 kB",
      "source_url": "https://travel.state.gov/content/travel/en/us-visas/visa-information-resources/photos.html",
      "source_checked": "2026-10-12",
      "pixid_guide_url": "https://www.pixid.studio/guide/dv-lottery-photo-requirements-2026",
      "verification": "official_text_read",
      "notes": "Exactly 600x600 px. Scanned prints: 2x2 in at 300 ppi. Selectees bring two 2x2 in prints."
    },
    {
      "id": "gb-passport-online",
      "country": "United Kingdom",
      "iso2": "GB",
      "document": "Passport (online)",
      "width_mm": null,
      "height_mm": null,
      "width_px": null,
      "height_px": null,
      "min_px": "600x750",
      "max_px": null,
      "dpi": null,
      "head_height_mm": null,
      "head_height_pct": null,
      "eye_line": null,
      "background": "plain light-coloured, clear contrast",
      "glasses": "avoid unless needed; no sunglasses/tinted; no glare or frames over eyes",
      "expression": "plain expression, mouth closed, eyes open",
      "digital_format": "colour, unaltered",
      "file_size": "50 KB - 10 MB",
      "source_url": "https://www.gov.uk/photos-for-passports",
      "source_checked": "2026-10-12",
      "pixid_guide_url": "https://www.pixid.studio/guide/uk",
      "verification": "official_text_read",
      "notes": "Photo must be taken in the last month. Own-device photos: do not crop (cropped by HMPO)."
    },
    {
      "id": "ca-passport-print",
      "country": "Canada",
      "iso2": "CA",
      "document": "Passport (print)",
      "width_mm": 50,
      "height_mm": 70,
      "width_px": null,
      "height_px": null,
      "min_px": null,
      "max_px": null,
      "dpi": null,
      "head_height_mm": "31-36",
      "head_height_pct": null,
      "eye_line": null,
      "background": "plain white or light-coloured",
      "glasses": "allowed if eyes clearly visible, no glare; no sunglasses or tinted lenses",
      "expression": "neutral: eyes open, mouth closed, not smiling",
      "digital_format": null,
      "file_size": null,
      "source_url": "https://www.canada.ca/en/immigration-refugees-citizenship/services/canadian-passports/photos.html",
      "source_checked": "2026-10-12",
      "pixid_guide_url": "https://www.pixid.studio/guide/canada",
      "verification": "official_text_read",
      "notes": "2 identical professionally printed photos; colour or B&W; guarantor signs back of one. No home prints, no AI/editing."
    },
    {
      "id": "ca-passport-online-renewal",
      "country": "Canada",
      "iso2": "CA",
      "document": "Passport (online renewal)",
      "width_mm": null,
      "height_mm": null,
      "width_px": null,
      "height_px": null,
      "min_px": "1200x1800",
      "max_px": "3000x4500",
      "dpi": null,
      "head_height_mm": null,
      "head_height_pct": "45-50",
      "eye_line": null,
      "background": "plain white or light-coloured",
      "glasses": "allowed if eyes clearly visible, no glare; no tinted lenses",
      "expression": "neutral: eyes open, mouth closed",
      "digital_format": "JPEG, 3:2 portrait (h:w)",
      "file_size": "200 KB - 5 MB",
      "source_url": "https://www.canada.ca/en/immigration-refugees-citizenship/services/canadian-passports/photos.html",
      "source_checked": "2026-10-12",
      "pixid_guide_url": "https://www.pixid.studio/guide/canadian-passport-photo",
      "verification": "official_text_read",
      "notes": "Must be taken by a commercial photographer, saved directly from camera; no scans, no alteration."
    },
    {
      "id": "ca-visa-ircc-temporary-resident",
      "country": "Canada",
      "iso2": "CA",
      "document": "Visa (IRCC temporary resident)",
      "width_mm": 35,
      "height_mm": 45,
      "width_px": null,
      "height_px": null,
      "min_px": null,
      "max_px": null,
      "dpi": null,
      "head_height_mm": "31-36",
      "head_height_pct": null,
      "eye_line": null,
      "background": "plain white or light-coloured",
      "glasses": "non-tinted prescription allowed if eyes clearly visible; no sunglasses",
      "expression": "neutral, mouth closed",
      "digital_format": null,
      "file_size": null,
      "source_url": "https://www.canada.ca/en/immigration-refugees-citizenship/services/application/application-forms-guides/temporary-resident-visa-application-photograph-specifications.html",
      "source_checked": "2026-10-12",
      "pixid_guide_url": "https://www.pixid.studio/guide/canada-visa-photo",
      "verification": "official_text_read",
      "notes": "Frame size at least 35x45 mm. Two identical photos, colour or B&W, within 6 months."
    },
    {
      "id": "au-passport",
      "country": "Australia",
      "iso2": "AU",
      "document": "Passport",
      "width_mm": "35-40",
      "height_mm": "45-50",
      "width_px": null,
      "height_px": null,
      "min_px": null,
      "max_px": null,
      "dpi": null,
      "head_height_mm": "32-36",
      "head_height_pct": null,
      "eye_line": null,
      "background": null,
      "glasses": "no glasses (camera operator guidelines)",
      "expression": "neutral",
      "digital_format": null,
      "file_size": null,
      "source_url": "https://www.passports.gov.au/help/passport-photos",
      "source_checked": "2026-10-12",
      "pixid_guide_url": "https://www.pixid.studio/guide/australia",
      "verification": "official_text_read",
      "notes": "Chin-to-crown measured to top of skull, not hair. Glasses rule from APO Camera Operator Guidelines PDF."
    },
    {
      "id": "in-passport-passport-seva-upload",
      "country": "India",
      "iso2": "IN",
      "document": "Passport (Passport Seva upload)",
      "width_mm": null,
      "height_mm": null,
      "width_px": 630,
      "height_px": 810,
      "min_px": null,
      "max_px": null,
      "dpi": null,
      "head_height_mm": null,
      "head_height_pct": "80-85 (face)",
      "eye_line": null,
      "background": "white",
      "glasses": "remove to avoid reflections",
      "expression": "natural, eyes open, mouth not open",
      "digital_format": "colour",
      "file_size": null,
      "source_url": "https://mportal.passportindia.gov.in/pdf/Guidelines_for_ICAO_Compliant_Photographs_for_Passport_Applications.pdf",
      "source_checked": "2026-10-12",
      "pixid_guide_url": "https://www.pixid.studio/guide/india",
      "verification": "official_text_read",
      "notes": "Face 80-85% of photograph. Taken ~1.5 m from camera. Some missions abroad (e.g. OCI/embassies) use 2x2 in prints — check mission."
    },
    {
      "id": "ng-passport-online-upload",
      "country": "Nigeria",
      "iso2": "NG",
      "document": "Passport (online upload)",
      "width_mm": null,
      "height_mm": null,
      "width_px": 600,
      "height_px": 800,
      "min_px": null,
      "max_px": null,
      "dpi": null,
      "head_height_mm": null,
      "head_height_pct": null,
      "eye_line": null,
      "background": "white",
      "glasses": null,
      "expression": null,
      "digital_format": null,
      "file_size": "<2 MB",